<?xml version="1.0" encoding="UTF-8"?>
<OrderHero xmlns:xsi="http://www.w3.org/2001/XMLSchema-instance" xsi:noNamespaceSchemaLocation="OrderHero.xsd">
  <Bestand>
    <Produkt>
      <Produkt_ID>0</Produkt_ID>
      <Produktangaben>
        <Produktname>Produktname</Produktname>
        <Preis_in_Euro>0.0</Preis_in_Euro>
        <Beschreibung>Beschreibung</Beschreibung>
      </Produktangaben>
    </Produkt>
    <Anzahl>0</Anzahl>
    <Verfuegbarkeit>verfuegbar</Verfuegbarkeit>
  </Bestand>
  <Bestellungsliste>
    <Bestellung>
      <Bestellungs_ID>0</Bestellungs_ID>
      <Lieferdatum>2001-01-01</Lieferdatum>
      <Person>
        <Typ>Gastronom</Typ>
        <Vorname>Vorname</Vorname>
        <Nachname>Nachname</Nachname>
        <Alter>0</Alter>
        <Betrieb>
          <Betriebname/>
          <Adresse>
            <Straße>Straße</Straße>
            <Hausnummer>0</Hausnummer>
            <PLZ>0</PLZ>
          </Adresse>
        </Betrieb>
      </Person>
      <Betrieb>
        <Betriebname/>
        <Adresse>
          <Straße>Straße</Straße>
          <Hausnummer>0</Hausnummer>
          <PLZ>0</PLZ>
        </Adresse>
      </Betrieb>
      <Person>
        <Typ>Gastronom</Typ>
        <Vorname>Vorname</Vorname>
        <Nachname>Nachname</Nachname>
        <Alter>0</Alter>
        <Betrieb>
          <Betriebname/>
          <Adresse>
            <Straße>Straße</Straße>
            <Hausnummer>0</Hausnummer>
            <PLZ>0</PLZ>
          </Adresse>
        </Betrieb>
      </Person>
      <Betrieb>
        <Betriebname/>
        <Adresse>
          <Straße>Straße</Straße>
          <Hausnummer>0</Hausnummer>
          <PLZ>0</PLZ>
        </Adresse>
      </Betrieb>
      <Anzahl>0</Anzahl>
      <Produkt>
        <Produkt_ID>0</Produkt_ID>
        <Produktangaben>
          <Produktname>Produktname</Produktname>
          <Preis_in_Euro>0.0</Preis_in_Euro>
          <Beschreibung>Beschreibung</Beschreibung>
        </Produktangaben>
      </Produkt>
      <Bestellungsart>Dauerauftrag</Bestellungsart>
      <Zahlungsart>Rechnung</Zahlungsart>
      <Gesamtbetrag_Bestellung>0</Gesamtbetrag_Bestellung>
    </Bestellung>
  </Bestellungsliste>
  <Boerse>
    <Eintrag>
      <Person>
        <Typ>Gastronom</Typ>
        <Vorname>Vorname</Vorname>
        <Nachname>Nachname</Nachname>
        <Alter>0</Alter>
        <Betrieb>
          <Betriebname/>
          <Adresse>
            <Straße>Straße</Straße>
            <Hausnummer>0</Hausnummer>
            <PLZ>0</PLZ>
          </Adresse>
        </Betrieb>
      </Person>
      <Erstellungsdatum>2001-12-31T12:00:00</Erstellungsdatum>
      <Titel>Titel</Titel>
      <Informationstext>Informationstext</Informationstext>
      <Startdatum>2001-12-31T12:00:00</Startdatum>
      <Ablaufdatum>2001-12-31T12:00:00</Ablaufdatum>
      <Kommentare>
        <Person>
          <Typ>Gastronom</Typ>
          <Vorname>Vorname</Vorname>
          <Nachname>Nachname</Nachname>
          <Alter>0</Alter>
          <Betrieb>
            <Betriebname/>
            <Adresse>
              <Straße>Straße</Straße>
              <Hausnummer>0</Hausnummer>
              <PLZ>0</PLZ>
            </Adresse>
          </Betrieb>
        </Person>
        <Datum>2001-12-31T12:00:00</Datum>
        <Informationstext>Informationstext</Informationstext>
      </Kommentare>
      <Typ>Angebot</Typ>
    </Eintrag>
  </Boerse>
  <Geschaeftspartnerliste>
    <Listentyp>Kundenliste</Listentyp>
    <Person>
      <Typ>Gastronom</Typ>
      <Vorname>Vorname</Vorname>
      <Nachname>Nachname</Nachname>
      <Alter>0</Alter>
      <Betrieb>
        <Betriebname/>
        <Adresse>
          <Straße>Straße</Straße>
          <Hausnummer>0</Hausnummer>
          <PLZ>0</PLZ>
        </Adresse>
      </Betrieb>
    </Person>
    <Bestellung>
      <Bestellungs_ID>0</Bestellungs_ID>
      <Lieferdatum>2001-01-01</Lieferdatum>
      <Person>
        <Typ>Gastronom</Typ>
        <Vorname>Vorname</Vorname>
        <Nachname>Nachname</Nachname>
        <Alter>0</Alter>
        <Betrieb>
          <Betriebname/>
          <Adresse>
            <Straße>Straße</Straße>
            <Hausnummer>0</Hausnummer>
            <PLZ>0</PLZ>
          </Adresse>
        </Betrieb>
      </Person>
      <Betrieb>
        <Betriebname/>
        <Adresse>
          <Straße>Straße</Straße>
          <Hausnummer>0</Hausnummer>
          <PLZ>0</PLZ>
        </Adresse>
      </Betrieb>
      <Person>
        <Typ>Gastronom</Typ>
        <Vorname>Vorname</Vorname>
        <Nachname>Nachname</Nachname>
        <Alter>0</Alter>
        <Betrieb>
          <Betriebname/>
          <Adresse>
            <Straße>Straße</Straße>
            <Hausnummer>0</Hausnummer>
            <PLZ>0</PLZ>
          </Adresse>
        </Betrieb>
      </Person>
      <Betrieb>
        <Betriebname/>
        <Adresse>
          <Straße>Straße</Straße>
          <Hausnummer>0</Hausnummer>
          <PLZ>0</PLZ>
        </Adresse>
      </Betrieb>
      <Anzahl>0</Anzahl>
      <Produkt>
        <Produkt_ID>0</Produkt_ID>
        <Produktangaben>
          <Produktname>Produktname</Produktname>
          <Preis_in_Euro>0.0</Preis_in_Euro>
          <Beschreibung>Beschreibung</Beschreibung>
        </Produktangaben>
      </Produkt>
      <Bestellungsart>Dauerauftrag</Bestellungsart>
      <Zahlungsart>Rechnung</Zahlungsart>
      <Gesamtbetrag_Bestellung>0</Gesamtbetrag_Bestellung>
    </Bestellung>
  </Geschaeftspartnerliste>
  <Produkte>
    <Produkt>
      <Produkt_ID>0</Produkt_ID>
      <Produktangaben>
        <Produktname>Produktname</Produktname>
        <Preis_in_Euro>0.0</Preis_in_Euro>
        <Beschreibung>Beschreibung</Beschreibung>
      </Produktangaben>
    </Produkt>
    <Verfuegbarkeit>verfuegbar</Verfuegbarkeit>
    <Person>
      <Typ>Gastronom</Typ>
      <Vorname>Vorname</Vorname>
      <Nachname>Nachname</Nachname>
      <Alter>0</Alter>
      <Betrieb>
        <Betriebname/>
        <Adresse>
          <Straße>Straße</Straße>
          <Hausnummer>0</Hausnummer>
          <PLZ>0</PLZ>
        </Adresse>
      </Betrieb>
    </Person>
  </Produkte>
</OrderHero>
